,제목,가격,리뷰수,리뷰평점,평점비율
0,*oleman 8-Person Tent for Camping | Elite Montana Tent with Easy Setup,$157.99,"7,220",4.6,"['76%', '13%', '5%', '2%', '4%']"
1,"*ise Owl Outfitters Camping Hammocks - Portable Hammock for Outdoor, Indoor, Single & Double Use w/ Tree Straps - Backpacking, Travel, and Camping Accessories",$29.95,"30,592",4.8,"['86%', '10%', '3%', '1%', '1%']"
2,"*lectric Lighter, Locsee USB Rechargeable Lighter Arc Long Grill Lighter Flameless Lighter with LED Battery Display Windproof Lighter with Safe Button for BBQ Camping Kitchen Stove",$10.99,67,4.4,"['71%', '11%', '7%', '3%', '8%']"
3,*amping Pillow by Mountain Designs - Comfortable Inflatable Pillow and Camping Pillows - Camp Pillow is Lightweight and Comfortable. Camping Gear and Camping Accessories by Mountain Designs,$12.99,20,4.7,"['77%', '15%', '9%', '0%', '0%']"
4,"*ollapsible Cutting Board with Colander, HI NINGER 3 in1 Foldable Chopping Board No Scissors, Space Saving Kitchen Vegetable Washing Basket Silicone Dish Tub for Camping/Picnic/BBQ/Kitchen",$17.99,"1,759",4.4,"['67%', '18%', '8%', '3%', '4%']"
5,"*OVTOTOP Sleeping Pad for Camping,【2021 Newest】 Foam Self-Inflating Ultralight Thicken Sleeping Mat with Attached Pillow, Perfect Gear for Hiking, Traveling and Backpacking (Self-Inflating)",$67.99,4,4.1,"['43%', '28%', '29%', '0%', '0%']"
6,"*loudi USB Rechargeable Portable Fan , 10000MAH Battery Operated Camping Fan with LED Lantern and Hanging Hook ,3 Speed Adjustable Personal Small Desk Fan for Sleeping,Tent,Office,Home,Travel",$19.99,215,4.7,"['87%', '6%', '2%', '1%', '3%']"
7,*doland Portable LED Camping Lantern with Ceiling Fan - Hurricane Emergency Survival Kit,$20.84,"24,475",4.3,"['64%', '18%', '10%', '4%', '4%']"
8,"*odoer Camping Hammock - Travel Hammock with 2 Tree Straps, Double Hammock, Durable Nylon Parachute Portable Hammock for Outdoor, Hiking, Backpacking, Yard ( Grey & Blue )",$19.99,133,4.7,"['81%', '13%', '4%', '2%', '0%']"
9,"*ifeStraw Personal Water Filter for Hiking, Camping, Travel, and Emergency Preparedness",$17.47,"73,304",4.8,"['84%', '12%', '3%', '0%', '1%']"
10,*oleman Sundome Tent,$69.99,"31,496",4.7,"['80%', '13%', '4%', '1%', '2%']"
11,"*ont 2 Pack LED Camping Lantern, Super Bright Portable Survival Lanterns, Must Have During Hurricane, Emergency, Storms, Outages, Original Collapsible Camping Lights/Lamp (Batteries Included)",$17.97,"41,594",4.7,"['81%', '12%', '4%', '1%', '1%']"
12,"*andcrafted Mexican Blankets, Artisanal Handwoven Serape Blanket, Authentic Falsa Blanket, Great As Beach Blanket, Camping Blanket, Picnic Blanket, Outdoor Blanket, Boho Throw Blankets, Flag",$22.99,"2,041",4.7,"['82%', '10%', '5%', '1%', '1%']"
13,"*andcrafted Mexican Blankets, Artisanal Handwoven Serape Blanket, Authentic Falsa Blanket, Great As Beach Blanket, Camping Blanket, Picnic Blanket, Outdoor Blanket, Boho Throw Blankets, Fluore Green",$22.99,"2,041",4.7,"['82%', '10%', '5%', '1%', '1%']"
14,"*andcrafted Mexican Blankets, Artisanal Handwoven Serape Blanket, Authentic Falsa Blanket, Great As Beach Blanket, Camping Blanket, Picnic Blanket, Outdoor Blanket, Boho Throw Blankets, Emerald Coral",$22.99,"2,041",4.7,"['82%', '10%', '5%', '1%', '1%']"
15,"*andcrafted Mexican Blankets, Artisanal Handwoven Serape Blanket, Authentic Falsa Blanket, Great As Beach Blanket, Camping Blanket, Picnic Blanket, Outdoor Blanket, Boho Throw Blankets, Bottle",$22.99,"2,041",4.7,"['82%', '10%', '5%', '1%', '1%']"
16,"*andcrafted Mexican Blankets, Artisanal Handwoven Serape Blanket, Authentic Falsa Blanket, Great As Beach Blanket, Camping Blanket, Picnic Blanket, Outdoor Blanket, Boho Throw Blankets, Oxford",$22.99,"2,041",4.7,"['82%', '10%', '5%', '1%', '1%']"
17,*doland Portable LED Camping Lantern with Ceiling Fan - Hurricane Emergency Survival Kit,$20.84,"24,475",4.3,"['64%', '18%', '10%', '4%', '4%']"
18,"*olar Power Bank 26,800mAh Wireless Solar Charger USB C 3.1A Fast Charge 4 Outputs & Dual Inputs Portable Charger IP66 Waterproof with 18 LED Flashlight External Battery Pack for Camping Outdoor",Out of Stock,58,4.4,"['65%', '16%', '8%', '11%', '0%']"
19,*ALEAF Women's Hiking Cargo Pants Outdoor Lightweight Capris Water Resistant UPF 50 Zipper Pockets,$33.99,"3,203",4.5,"['70%', '16%', '7%', '3%', '4%']"
20,"*leeping Pad for Camping, LUXEAR Inflatable Camping Pad for 2 Person Foot Press Lightweight Backpacking Mat for Hiking Travel Camping Durable Waterproof Air Mattress Compact Hiking Pad",$59.99,135,4.0,"['57%', '16%', '10%', '5%', '13%']"
21,"*8Wh Portable Power Station, 24000mAh Camping Solar Generators Lithium Battery Power Supply with 110V/80W(Peak 120W) AC Outlet, USB QC3.0, LED Flashlights for CPAP Home Camping Emergency Backup",Out of Stock,501,4.5,"['74%', '12%', '6%', '2%', '5%']"
22,"*olar Powered Bug Zapper, 3-in-1 Electric Mosquito Killer and Camp Lantern, Portable Mosquito Zapper for Outdoor & Indoor, Waterproof Rechargeable Insect Fly Trap Attractant for Camping Patio Bedroom",$36.99,60,3.7,"['47%', '21%', '7%', '7%', '19%']"
23,"*xtremus Portable Camp Stove, Compact Wind Resistant Camping Stove for Backpacking, Hiking, Camping, and Tailgating, Ultralight",$12.99,25,4.6,"['70%', '21%', '10%', '0%', '0%']"
24,*IGLT Portable Shower Bag 5 Gallons Camping Shower Bag 20L with Removable Hose and Shower Head for Camping Outdoor Traveling Hiking Summer Shower,Out of Stock,174,4.1,"['54%', '20%', '14%', '4%', '9%']"
25,*GVANG Camping Cookware Set Portable Outside Camping Cooking Mess Kit 1-2 Person Pots Pan for Backpacking Hiking Picnic Fishing (Orange),$27.59,21,4.5,"['65%', '28%', '0%', '7%', '0%']"
26,"*ltom Beach Tent, Portable Beach Sun Shelter for UPF 50+ UV Protection, Easy Set Up 3-4 Person Beach Tent Shade with Carry Bag, Anti UV Beach Canopy Tent for Fishing Hiking Camping, Light Blue",$37.99,2,5.0,"['100%', '0%', '0%', '0%', '0%']"
27,"*OTTEOX Multitools Camping Accessories Gifts for Dad Boyfriend, Unique Anniversary Christmas Birthday Gift Ideas for Men Him Stainless Steel Multi Tool Survival Gear gifts for fathers day",$18.96,622,4.5,"['70%', '18%', '8%', '2%', '3%']"
28,"*eayaeko Female Urinal,Female Urination Device, Pee Funnel for Women Reusable Women Pee Cup Silicone Portable Urinal for Women Can Wee She Pee Standing Up Travel Urinal for Outdoor with Bag",$10.99,15,4.5,"['82%', '0%', '9%', '0%', '9%']"
29,"*agesh Collapsible Sink 2 Pack - Outdoor Camping Picnic Basket Each 11L/2.90Gal Wash Basin, Portable Foldable Tub/Basin/Bucket with Sturdy Handle for Washing Dishes, Camping, Hiking and Home",$20.97,323,4.8,"['82%', '13%', '4%', '1%', '0%']"
30,"*ackery Portable Power Station Explorer 240, 240Wh Backup Lithium Battery, 110V/200W Pure Sine Wave AC Outlet, Solar Generator (Solar Panel Not Included) for Outdoors Camping Travel Hunting Emergency",$199.99,"8,001",4.8,"['87%', '9%', '2%', '1%', '2%']"
31,"*ise Owl Outfitters Camping Hammocks - Portable Hammock for Outdoor, Indoor, Single & Double Use w/ Tree Straps - Backpacking, Travel, and Camping Accessories",$26.95 - $39.95,"30,592",4.8,"['86%', '10%', '3%', '1%', '1%']"
32,*USTULE Double Sleeping Bag for Adults Cold Weather 2 Person Waterproof Sleeping Bag for Camping Lightweight Outdoor Hiking Backpacking Camping Gear Equipment,Out of Stock,1,5.0,"['100%', '0%', '0%', '0%', '0%']"
33,"*UV Car Ceiling Cargo Net Pocket, 35.5""x25.5"" Car Roof Storage Organizer, Long Trip Camping SUV Storage Bag Tent Putting Quilt Children's Toy Towel Sundries Interior Accessories",Out of Stock,7,3.3,"['25%', '25%', '25%', '0%', '25%']"
34,"*ortable Camping Fan Rechargeable With LED Lantern, 7800mAh Battery Operated USB Desk Fan with Remote Control, 180° Head Rotation Folding Outdoor Ceiling Tent Fan for Fishing, Outdoor, Office, Car",$27.99,56,4.6,"['82%', '8%', '0%', '5%', '5%']"
35,"*nfrere Camping Lanterns, 4 Pack Battery Powered Camping Lights Flashlight for Outdoor Camping Hiking, Survival Kits for Emergency, Power Failure, Hurricane (Batteries Not Included)",$24.99,12,5.0,"['100%', '0%', '0%', '0%', '0%']"
36,"*OVTOTOP Folding Camping Table, 2 Tier Portable Camp Table with Cup Holders and Carrying Bags, Camping Tables That Fold Up Lightweight for Indoor and Outdoor Picnic, Beach, Hiking, Travel, Fishing",$42.99,12,3.8,"['70%', '0%', '0%', '0%', '30%']"
37,"*ortable Camping Table, Collapsible Beach Table Folding Side Table Aluminum Top with Carry Bag for Outdoor Cooking, Hiking, Travel, Picnic, RV Fold Black",$25.99,97,3.9,"['55%', '17%', '11%', '5%', '13%']"
38,*AMIALOR Campsite Storage Strap with 12 PCS Buckles & 6 PCS Clothes Pins for Hanging Outdoor Camping Equipment | Garden Supplies Outdoor Camping Hammock&Tent Accessories,Out of Stock,150,4.6,"['78%', '13%', '4%', '1%', '4%']"
39,*oleman Sundome Tent,$63.99 - $189.76,"31,496",4.7,"['80%', '13%', '4%', '1%', '2%']"
40,"*uckatch Beach Blanket, Large Beach Mat Waterproof Sandproof for Outdoor, Picnic, Camping ,Travel, Lightweight Portable Beach Essentials, 80.7’’ x 80.7’’ for 3 to 6 Adults",$19.99,8,5.0,"['100%', '0%', '0%', '0%', '0%']"
41,"*DSTAR Beach Blanket, Large 79”×79” Waterproof Sandproof Beach Mat for 3-7 Adults, Double Anchored with 4 Corner Sand Pockets and 5 Stakes, Picnic Blankets for Vacation,Travel, Camping, Hiking",$16.99,9,5.0,"['100%', '0%', '0%', '0%', '0%']"
42,"*aliven Portable Telescopic Stool with 4400mAh Mobile Charger, Built-in Phone Charger for iPhone Android 3nd Gen Foldable Stool for Indoor/Outdoor/Gardening Max Load 400lbs(Blue)",$35.99,4,5.0,"['100%', '0%', '0%', '0%', '0%']"
43,"*uckatch Beach Blanket, Large Beach Mat Waterproof Sandproof for Outdoor, Picnic, Camping ,Travel, Lightweight Portable Beach Essentials, 80.7’’ x 80.7’’ for 3 to 6 Adults",$19.99,8,5.0,"['100%', '0%', '0%', '0%', '0%']"
44,"*iaZ Dog Tie Out Cable for Camping, 50ft Portable Overhead Trolley System for Dogs up to 200lbs，Dog Lead for Yard, Camping, Parks, Outdoor Events,5 min Set-up",$36.99,69,4.6,"['76%', '11%', '8%', '2%', '2%']"
45,"*askys Camping Sleeping Bag - 3 Season Warm & Cool Weather - Summer, Spring, Fall, Lightweight, Waterproof for Adults & Kids - Camping Gear Equipment, Traveling, and Outdoors",$119.97,"13,565",4.5,"['70%', '18%', '7%', '2%', '2%']"
46,"*utland Firebowl 893 Deluxe Outdoor Portable Propane Gas Fire Pit with Cover & Carry Kit, 19-Inch Diameter 58,000 BTU",$133.99,"8,074",4.8,"['89%', '8%', '1%', '0%', '1%']"
47,*oleman Portable Butane Stove with Carrying Case,$29.99,"6,302",4.7,"['82%', '12%', '4%', '1%', '2%']"
48,*olar Fairy Lights 2 Pack 33Ft 100LED Solar String Lights Outdoor with 8 Lighting Modes Solar Powered Waterproof Garden Lights Decoration Copper Wire Lights for Patio Christmas Camping (Warm White),$14.99,20,4.2,"['61%', '11%', '17%', '10%', '0%']"
49,"*kasumer Camping Lantern with Battery, Rechargeable LED Camping Lights, Super Bright, Portable Foldaway Lantern Available to Camping, Hiking, Emergency, Hurricane, Power Outages, 2 Pack, UL Certified",$29.99,0,0.0,"['0%', '0%', '0%', '0%', '0%']"
50,"*ero Breeze Mark 2 Battery Powered Portable Air Conditioner, 2300 BTU, 240w Low Power Consumption with 24v DC, Off-grid, Design for Outdoor/RV Life","$1,499.00",14,3.4,"['36%', '20%', '12%', '12%', '20%']"
51,"*utdoor Camping Fan with LED Lantern and Hook, Portable Fan Rechargeable, 10400mAh Battery Operated Powered Fan, Personal USB Small Desk Fan, Fan for Tent, Travel, Bedroom, Table, Home, Office",$39.99,"1,077",4.4,"['70%', '16%', '8%', '3%', '4%']"
52,*IFUUR Water Sports Shoes Barefoot Quick-Dry Aqua Yoga Socks Slip-on for Men Women,$8.68 - $14.55,"65,768",4.4,"['67%', '15%', '9%', '4%', '5%']"
53,"*olar Camping Fans for Tents,Tent Fan Light Combo,5000mAh 4 Speeds,Rechargeable USB Output Port,Portable Camp Ceiling Fan Lantern,Desk Fan for Home,Office,Car RV",$27.99,62,4.3,"['67%', '16%', '6%', '6%', '6%']"
54,*olumbia Women's Switchback III Adjustable Waterproof Rain Jacket,$30.51 - $110.93,"8,519",4.5,"['73%', '13%', '7%', '3%', '4%']"
55,"*GY Camping Tent 2 Room Large Space for 3-6 People, Weatherproof,for Parties,Picnic, Outdoors Travel,Camping Family Tents",$175.99,2,4.0,"['50%', '0%', '50%', '0%', '0%']"
56,"*limpiaFit Microfiber Towels - Quick Dry 3 Size Pack (51inx31in, 30inx15in, 15inx15in) Camping, Sports, Beach, Backpacking, Gym, Travel Towels with Bag - Soft, Compact, Lightweight",$16.90,"7,665",4.7,"['80%', '14%', '4%', '1%', '1%']"
57,"*ikenture Double Sleeping Pad for Camping 2 Person 3.75"" Air Mattress Inflatable Queen Mat Adults Camp Bed Lightweight and Compact - for Backpacking,Car Camping,Hiking,Tent,Cot,Truck (Navy Foot Pump)",$76.99,"1,541",4.5,"['75%', '14%', '4%', '2%', '4%']"
58,"*ED Camping Lantern, CT CAPETRONIX Rechargeable Camping Lights with 400LM 5 Light Modes Water-Resistant, 2 Pack Portable Tent Lights for Camping Power Outage Fishing Hiking Emergency Hurricane Home",$22.98,"2,226",4.6,"['79%', '13%', '4%', '2%', '2%']"
59,"*audblor Portable Travel Clothesline Cord, Adjustable 26ft Camping Clothes line, Laundry Drying Rope for Hotel Trip, Cruise, Outdoor/Indoor, with 12Pcs Stoppers, Windproof Clothespins",$12.98,304,4.1,"['53%', '20%', '15%', '5%', '6%']"
60,"*olar Charger, Durecopow 20000mAh Portable Outdoor Waterproof Solar Power Bank, Camping External Backup Battery Pack Dual 5V USB Ports Output, 2 Led Light Flashlight with Compass (Orange)",Out of Stock,"2,340",4.4,"['71%', '15%', '6%', '3%', '5%']"
61,"*oghlan's Two Burner Non-Stick Camp Griddle, 16.5 x 10-Inches Black",$19.98,"3,619",4.7,"['79%', '14%', '5%', '1%', '2%']"
62,"*ORQUE Marshmallow Roasting Sticks Extendable Camping Skewer for Fire Pit, Wooden Handle 32inch Metal Smore Sticks for BBQ Hotdog, Cooking, Campfire, Bonfire Set of 8",$13.97,642,4.7,"['79%', '14%', '5%', '1%', '1%']"
63,"*EENUO 5000mAh Camping Fan with LED Lights, 40 Hours Max Working Time Tent Fan with Hanging Hook, Rechargeable Battery Operated Desk Fan for Home & Office",$21.99,"2,856",4.6,"['75%', '14%', '6%', '2%', '3%']"
64,"*ater Dispenser, 5 Gallon Water Dispenser Pump USB Charging, Automatic Drinking Water Pump, Portable Electric Water Dispenser for Home, Kitchen, Office, Travel and Camping",$15.99,0,0.0,"['0%', '0%', '0%', '0%', '0%']"
65,"*iceC Ultralight High Back Folding Camping Chair, Upgrade with Removable Pillow, Side Pocket & Carry Bag, Compact & Heavy Duty for Outdoor, Camping (Set of 2 Black)",$115.99,693,4.4,"['67%', '16%', '8%', '4%', '5%']"
66,"*ahara Sailor Survival Shovel with Axe, High Carbon Steel Tactical Shovel Camping Shovel Hatchet Combo - 4 Thicken Extension Handles, 20-39.5 Inch Survival Gear and Equipment for Hiking Camping",$59.99,408,4.6,"['77%', '14%', '3%', '1%', '4%']"
67,"*odoer Camping Hammock - Travel Hammock with 2 Tree Straps, Single Hammock, Durable Nylon Parachute Portable Hammock for Outdoor, Hiking, Backpacking, Yard (Black & Grey)",$18.99,47,4.7,"['80%', '9%', '11%', '0%', '0%']"
68,"*MARDOO Beach Tent, Pop Up Beach Sunshade Sun Shelter with Carrying Bag (Turquoise, 10X9 FT(4 Poles))",$119.98,5,3.8,"['54%', '23%', '0%', '0%', '23%']"
69,"*oleman Xtreme 5 Cooler | 70 Quart Day Cooler | Hard Cooler Keeps Ice Up to 5 Days, Black",Out of Stock,"4,195",4.6,"['80%', '12%', '4%', '2%', '3%']"
70,*elescopic Stool Portable Folding Stool Fishing Stool Outdoors Stool for Kids/Adults Travel Hiking Camping Fishing Load 360 lbs (Red),$22.99,15,3.8,"['53%', '9%', '22%', '0%', '16%']"
71,"*aterproof Beach Blanket Sandproof , 2 Pack Large Oversized 78''×83''for 4-7 Adults,Sand Proof Mat , Portable Picnic Blankets ,Family Picnic Travel Camping Hiking",$22.99,0,0.0,"['0%', '0%', '0%', '0%', '0%']"
72,"*amping Hammock for Outdoors Travel Backpacking,Camping Gear-Double Hammock with Tree Straps(18+1 Loops) & Carabiners, Nylon Portable Hammock, 2 Person Hammock for Tree & Hiking Gear-660lbs",$19.99,70,4.8,"['91%', '4%', '6%', '0%', '0%']"
73,*AWATOUR Portable Elastic Travel Clothesline with 12pcs Clothespins Travel Gadgets for Outdoor and Indoor Use (Black),$9.99,"6,905",4.6,"['76%', '14%', '7%', '1%', '1%']"
74,"*ompact Hanging Toiletry Bag and Organizer, Water Resistant with Mesh Pockets (Maroon)",$15.99,"1,596",4.3,"['66%', '16%', '9%', '5%', '5%']"
75,"*olar Charger 20000mAh, Portable Solar Power Bank Waterproof Solar Phone Chargers Compatible with All Smartphone External Battery Pack with 2 USB Ports/LED Flashlights for Outdoor Camping(Black/Blue)",Out of Stock,904,4.4,"['71%', '15%', '5%', '3%', '5%']"
76,"*OVTOTOP Beach Tent Sun Shade Shelter, 3-4 Person Large Sunshade Canopy UPF 50 Sport Umbrella Instant Tent for Camping, Outdoor, Beach Accessories",$56.99,44,4.2,"['61%', '21%', '4%', '4%', '10%']"
77,"*ISPARKY Beach Blanket Oversized 82"" X79"" Sand Proof Beach Mat Outdoor Picnic Mat for Travel, Camping, Hiking",$28.99,42,3.9,"['53%', '13%', '15%', '9%', '10%']"
78,"*RETREE Camping Air Sleeping Pad Mat - Foot Press Inflatable Lightweight Backpacking Pad for Hiking Traveling, Durable Waterproof Air Mattress Compact Hiking Pad",$29.99,"2,025",4.4,"['66%', '19%', '6%', '3%', '6%']"
79,"*earLight LED Headlamp Flashlight S500 [2 Pack] - Running, Camping, and Outdoor Headlight Headlamps - Head Lamp with Red Safety Light for Adults and Kids",Out of Stock,"25,328",4.7,"['78%', '15%', '4%', '1%', '2%']"
80,"*RUITEAM Camping Sleeping Pad Self-Inflating Camping Pad Foam Sleeping Mat with Pillow Camping Mat for Backpacking, Traveling and Hiking",$29.99 - $99.98,131,4.3,"['63%', '17%', '10%', '5%', '5%']"
81,*egeMoudal Camping Cooker Set Camping Pot Outdoor Cookware Set Equipment Mountaineering Pot Aluminum Cooker BBQ Tableware Camping Pot,$27.99,"1,165",4.4,"['64%', '22%', '9%', '2%', '3%']"
82,"*00W Portable Power Station, Ecosonique 100W PD Input/Output Solar Generator with Super Fast Charge, 110V/296Wh Pure Sine Wave Rechargeable CPAP Backup Lithium Battery for Camping Adventure Blackout",Out of Stock,14,4.8,"['83%', '17%', '0%', '0%', '0%']"
83,"*nngrowy Shower Tent Pop-Up Privacy Tent Camping Portable Toilet Tent Outdoor Camp Bathroom Changing Dressing Room Instant Privacy Shelters for Hiking Beach Picnic Fishing Potty, Extra-Tall, UPF 50+",Out of Stock,24,4.2,"['66%', '9%', '10%', '6%', '10%']"
84,"*UPOLOGY Portable Camping Fans Lantern for Tents, Tent Fan Rechargeable with Remote Control, Quiet and Powerful Personal USB Desk Fan for Outdoor Camping, Home, Office (Black Red)",$29.99,269,4.5,"['74%', '13%', '5%', '3%', '5%']"
85,"*pcs Collapsible Silicone Food Storage Container with Lid - for Outdoor Camping, Travel,Hiking and Indoor Home Kitchen,Office,School Student,Green/Blue/Yellow",Out of Stock,21,4.1,"['64%', '9%', '12%', '8%', '8%']"
86,"*orbidden Road Backpacking Sleeping Bag - 3 Season Warm & Cool Weather, Portable Single Sleep Bag Lightweight Water Resistant Semi Envelope for Camping Hiking Backpacking - Compression Bag Included",Out of Stock,778,4.3,"['63%', '18%', '9%', '4%', '6%']"
87,*amping: Outdoor Skills for Your Weekend Adventure,$0.00,31,4.8,"['81%', '13%', '6%', '0%', '0%']"
88,"*ouble Camping Pad，SUPIPRO 2021 Newest 2 Person Sleeping Pad Inflatable with Foot Press Sleeping Mat,Extra-wide 47 inch Portable Waterproof and Compact Air Mattress for Camping,Beach,Self-Driving Tour",Out of Stock,77,4.2,"['52%', '28%', '10%', '6%', '5%']"
89,*rocs Men's and Women's Classic Clog,$28.99 - $107.00,22,4.8,"['89%', '7%', '2%', '1%', '2%']"
90,"*IVOSUN Heavy Duty Folding Collapsible Wagon Utility Outdoor Camping Cart with Universal Wheels & Adjustable Handle, Red",Out of Stock,20,4.9,"['85%', '15%', '0%', '0%', '0%']"
91,"*agical Flames Create Colorful & Vibrant Flames for Fire Pit - (12 Pack) - Campfire, Bonfire, Outdoor Fireplace – Magical, Colorful, Rainbow, Mystic – Twice the Color – Half the Price",$16.95,"5,174",4.6,"['75%', '14%', '7%', '3%', '2%']"
92,"*emale Urination Device, Female Urinal Silicone Funnel Urine Cups Portable Urinal for Women Standing Up to Pee Funnel Reusable Women Pee Funnel, Outdoor, Activities, Camping",Out of Stock,"10,500",4.5,"['75%', '13%', '7%', '2%', '3%']"
93,"*ultitool Survival Gear and Equipment,Camping Accessories Tool 14-in-1 Hatchet with Hammer Saw Screwdrivers Pliers Bottle Opener Durable Sheath, Cool Gadgets Unique Gifts for Dad Men",$18.89,0,0.0,"['0%', '0%', '0%', '0%', '0%']"
94,"*illpo Certipur-US Memory Foam Camping Mattress【Single:75""x30""x2.75"" Twin 75""x38""x2.75""】 Portable Sleeping Pad Floor Guest Bed Lightweight Outdoor Tent Mattress Removable Waterproof Cover Travel Bag",Out of Stock,"1,483",4.5,"['72%', '16%', '6%', '2%', '4%']"
95,"*coSmart ECO 11 Electric Tankless Water Heater, 13KW at 240 Volts with Patented Self Modulating Technology",$191.31,"2,771",4.4,"['73%', '13%', '5%', '2%', '6%']"
96,*amping Pillow by Mountain Designs - Comfortable Inflatable Pillow and Camping Pillows - Camp Pillow is Lightweight and Comfortable. Camping Gear and Camping Accessories by Mountain Designs,$12.99,20,4.7,"['77%', '15%', '9%', '0%', '0%']"
97,"*pgraded Car Ceiling Cargo Net Pocket (Bear More Weight and Droop Much Less), Car Camping Storage Bag SUV Accessories, Double-Layer Mesh Car Roof Storage Organizer for Tent Putting Quilt Toys Sundries",Out of Stock,4,4.1,"['70%', '0%', '0%', '30%', '0%']"
98,"*KTTAC Men's Outdoor Quick Dry Lightweight Stretchy Shorts for Hiking, Tactical, Camping, Travel with 6 Pockets",$33.99,"1,674",4.6,"['77%', '14%', '5%', '1%', '3%']"
99,*ANTINY Women's Hiking Cargo Pants Lightweight Quick Dry Outdoor Capris for Women Camping Athletic UPF 50 Zipper Pockets,$24.99,0,0.0,"['0%', '0%', '0%', '0%', '0%']"
100,"*urvival Shovel Axe, BANORES Camping Shovel Multifunctional Sets 19.37-38.97inch Lengthened Handle and Thicken Anti-Rusting Head with Storage Pouch for Camping, Hiking, Backpacking, Emergency",$49.99,87,4.7,"['78%', '19%', '0%', '3%', '0%']"
101,*10V Portable Ceiling Fan Disumos 15.7” Mini Ceiling Fan Hanging Camping Tent Fans for Outdoor Gazebo Battery Powered Ceiling Fan Silent Design …,$17.99,68,3.4,"['41%', '13%', '13%', '5%', '28%']"
102,"*ITAHOME Portable Toilet 5.8 Gallon,Travel RV Potty with Level Indicator,T-Type Water Outlets,Anti-Leak Handle Water Pump,Rotating Spout,for Camping, Boating,Hiking,Trips",Out of Stock,13,4.8,"['82%', '18%', '0%', '0%', '0%']"
103,"*ont 2 Pack LED Camping Lantern, Super Bright Portable Survival Lanterns, Must Have During Hurricane, Emergency, Storms, Outages, Original Collapsible Camping Lights/Lamp (Batteries Included)",$17.97,"41,594",4.7,"['81%', '12%', '4%', '1%', '1%']"
104,"*ise Owl Outfitters Camping Blankets - Puffy, Packable, Lightweight & Compact Insulated Camping Quilt for Outdoor - Backpacking, Beach, Camp, Travel and Hiking Essentials, Blue",Out of Stock,222,4.8,"['83%', '13%', '3%', '1%', '1%']"
105,"*uminAID Solar Inflatable Lanterns | Great for Camping, Hurricane Emergency Kits and Travel | As Seen on Shark Tank",$29.95,"4,962",4.7,"['83%', '11%', '4%', '1%', '1%']"
106,"*RUITEAM Pop Up Privacy Tent,Dressing Changing Room,Portable Outdoor Shower Tent,Privacy Shelters Room,Camp Toilet Tent for Camping and Hiking with Carrying Bag",$46.99,39,4.6,"['72%', '19%', '0%', '9%', '0%']"
107,*UTDOOR LIVING SUNTIME Camping Folding Portable Mesh Chair with Removabel Footrest,Out of Stock,667,4.5,"['74%', '15%', '5%', '3%', '3%']"
108,"*VER ADVANCED Screen House Room Outdoor Screened in Canopy for Camping Zippered Mesh Tent 8-10 Person for Patios Shelter, 12' x10'",Out of Stock,107,4.1,"['54%', '22%', '8%', '6%', '9%']"
109,"*icnic Blankets Beach Blanket Camping Mat Sandfree Waterproof Oversized Foldable Portable Blanket for Travel/Camping/Hiking/Outdoor/Festivals, Extra Large 60” X 80”",$24.98,40,4.7,"['88%', '6%', '0%', '0%', '6%']"
110,*elf Inflating Sleeping Pad for Camping - Extra Thickness & Compact Lightweight Camping Mattress with Foot Pump Waterproof Camping Mat for Tent Hiking Car Traveling Backpacking,$42.95,258,4.2,"['66%', '14%', '4%', '4%', '11%']"
111,"*esh Outdoor Food Cover Tents (6 pack): Collapsible Umbrella Tents for Picnics, BBQ, Camping & Outdoor Cooking; Pop Up Screen Net & Plate Protector; Shields Food Plates & Glasses From Flies, Bugs",Out of Stock,"1,313",4.4,"['69%', '16%', '8%', '3%', '4%']"
112,"*offee Gator French Press Coffee Maker- Insulated, Stainless Steel Manual Coffee Makers For Home, Camping w/ Travel Canister- Presses 4 Cup Serving- Large, Gray",$27.99,"4,620",4.7,"['83%', '10%', '3%', '1%', '2%']"
113,*macool 10000mAh Battery Operated Camping Fan with LED Light-7 inch USB Fan with Hanging Hook for Tent Car RV Hurricane Emergency Outage,$33.99,828,4.7,"['81%', '10%', '4%', '1%', '3%']"
114,"*alkie Talkies 3 Pack, Rechargeable Easy to Use Family Walky Talky Long Range 2 Way Radio Gift with NOAA Weather Channel Micro-USB Charger/Battery/Lanyard Hiking Camping Trip",$51.99,"4,068",4.4,"['68%', '17%', '7%', '3%', '5%']"
115,"*POLAR 2021 8-Inch Rechargeable Battery Operated Foldaway Fan, Remote Control, Oscillating, Timer, 7200mAh 4-Speed, Cordless Standing Pedestal Fan for Home Office Outdoor Camping Tent Travel",$49.99,339,4.6,"['79%', '11%', '4%', '1%', '6%']"
116,"*iotem Bug Zapper, Indoor Outdoor Mosquito Killer USB Powered Solar Bug Mosquito Zapper Waterproof IP66",Out of Stock,317,4.2,"['64%', '17%', '4%', '4%', '10%']"
117,"*edmoon 4Pcs 5L Collapsible Water Container, BPA Free,Outdoor Folding Travel Climbing Camp Emergency Water Bag Container Package for Sport Camping Riding Mountaineer, Food Grade",Out of Stock,1,4.0,"['0%', '100%', '0%', '0%', '0%']"
118,"*ayavoo Sleeping Pad for Camping, 28in Wide, Ultralight Compact Self Inflatable Camping Mat, Large Durable Waterproof Air Mattress for Backpacking, Hiking, Traveling, Tent Gear, Camp Sleep Pad - Bed",$25.99,0,0.0,"['0%', '0%', '0%', '0%', '0%']"
